{
  "schema_version": "mucaro-release-scope-manifest/1.0",
  "manifest_id": "MUCARO_RELEASE_SCOPE_V1",
  "created_utc": "2026-09-24T21:00:00Z",
  "release_class": {
    "name": "direct-distribution macOS desktop workbench",
    "platform": "macOS",
    "architectures": [
      "arm64"
    ],
    "minimum_os": "14.0",
    "distribution": "Developer ID direct download (.app in .zip/.dmg); Mac App Store lane is an unadopted ENHANCEMENT (SD-009)",
    "notes": "Declared hardware baseline: Apple Silicon, 16 GB RAM, 10 GB free storage (assumption A3; see docs/release/RELEASE_ENGINEERING_STATE.md). Minimum macOS raised from 13.0 to 14.0 by RC-008: the pinned pyproj 3.7.2 and rasterio 1.4.3 arm64 wheels require macOS 14."
  },
  "bound_specifications": [
    {
      "spec_id": "MUCARO_RELEASE_ENGINEERING_CONTRACT_V1",
      "title": "Mucaro AI Release-Grade Workbench Specification (canonical MUCARO_RELEASE_ENGINEERING_CONTRACT_V1 binding)",
      "path": "docs/release/MUCARO_RELEASE_ENGINEERING_CONTRACT_V1.md",
      "version": null,
      "sha256": "5d031f20011bc04dae796ae9edda25bcf6e004e65f85124f0de99a0f4b079ad5",
      "id_pattern": "^(?P<id>(?:GOAL|KERNEL|INV|TGT|MATRIX)-[0-9]{3}) — (?P<title>.+)$",
      "id_prefix": "",
      "extra_named_requirements": [
        {
          "requirement_id": "CERT-RULE-001",
          "heading": "TERMINAL CERTIFICATION RULE"
        },
        {
          "requirement_id": "EXEC-DIRECTIVE-001",
          "heading": "FINAL AUTONOMOUS EXECUTION DIRECTIVE"
        },
        {
          "requirement_id": "LEARN-GATE-001",
          "heading": "POST-CERTIFICATION LEARNING GATE 🚩"
        }
      ],
      "binding": "BOUND",
      "provenance": "User-issued contract text committed 2026-09-24; formally adopted by project owner on 2026-10-20 as the canonical Mucaro AI Release-Grade Workbench Specification without denominator expansion."
    },
    {
      "spec_id": "MOBILE_INTERACTION_EXTRACTION_V1",
      "title": "Mucaro AI: mobile interaction extraction",
      "path": "docs/release/MOBILE_INTERACTION_EXTRACTION_V1.md",
      "version": null,
      "sha256": "9a13a192fc51a4419dbee8bc1cfb43a5939e0c94d1e90e6a3fa096967f4558ab",
      "id_pattern": "^(?P<id>F[0-9]{2})\\t(?P<title>[^\\t]+)\\t",
      "id_prefix": "MOB-",
      "extra_named_requirements": [],
      "binding": "BOUND",
      "provenance": "User-issued brief (source recording ZIP SHA-256 db2e4759...c469c4), committed verbatim 2026-09-24."
    }
  ],
  "missing_specifications": [],
  "requirements": [
    {
      "requirement_id": "GOAL-001",
      "title": "Product outcome",
      "source": "MUCARO_RELEASE_ENGINEERING_CONTRACT_V1",
      "requirement_class": "GOAL",
      "scope_state": "IN_SCOPE",
      "verification_method": "PACKAGING_EVIDENCE",
      "crosswalk": [
        "PKG-05",
        "PKG-07",
        "V21",
        "V22"
      ]
    },
    {
      "requirement_id": "GOAL-002",
      "title": "Primary interaction model",
      "source": "MUCARO_RELEASE_ENGINEERING_CONTRACT_V1",
      "requirement_class": "GOAL",
      "scope_state": "IN_SCOPE",
      "verification_method": "RENDERED_EVIDENCE",
      "crosswalk": [
        "CLI-10",
        "V21",
        "V07"
      ]
    },
    {
      "requirement_id": "GOAL-003",
      "title": "Governing objective",
      "source": "MUCARO_RELEASE_ENGINEERING_CONTRACT_V1",
      "requirement_class": "GOAL",
      "scope_state": "IN_SCOPE",
      "verification_method": "PROCESS_AUDIT",
      "crosswalk": [
        "V19",
        "V20"
      ]
    },
    {
      "requirement_id": "KERNEL-001",
      "title": "Instruction precedence",
      "source": "MUCARO_RELEASE_ENGINEERING_CONTRACT_V1",
      "requirement_class": "PROCESS",
      "scope_state": "IN_SCOPE",
      "verification_method": "PROCESS_AUDIT",
      "crosswalk": []
    },
    {
      "requirement_id": "KERNEL-002",
      "title": "Binding target and denominator",
      "source": "MUCARO_RELEASE_ENGINEERING_CONTRACT_V1",
      "requirement_class": "PROCESS",
      "scope_state": "IN_SCOPE",
      "verification_method": "LEDGER_VALIDATOR",
      "crosswalk": []
    },
    {
      "requirement_id": "KERNEL-003",
      "title": "Binding specification discovery",
      "source": "MUCARO_RELEASE_ENGINEERING_CONTRACT_V1",
      "requirement_class": "PROCESS",
      "scope_state": "IN_SCOPE",
      "verification_method": "LEDGER_VALIDATOR",
      "crosswalk": []
    },
    {
      "requirement_id": "KERNEL-004",
      "title": "Current-state snapshot",
      "source": "MUCARO_RELEASE_ENGINEERING_CONTRACT_V1",
      "requirement_class": "PROCESS",
      "scope_state": "IN_SCOPE",
      "verification_method": "LEDGER_VALIDATOR",
      "crosswalk": []
    },
    {
      "requirement_id": "KERNEL-005",
      "title": "Reuse validated work",
      "source": "MUCARO_RELEASE_ENGINEERING_CONTRACT_V1",
      "requirement_class": "PROCESS",
      "scope_state": "IN_SCOPE",
      "verification_method": "PROCESS_AUDIT",
      "crosswalk": []
    },
    {
      "requirement_id": "KERNEL-006",
      "title": "Dependency DAG",
      "source": "MUCARO_RELEASE_ENGINEERING_CONTRACT_V1",
      "requirement_class": "PROCESS",
      "scope_state": "IN_SCOPE",
      "verification_method": "LEDGER_VALIDATOR",
      "crosswalk": []
    },
    {
      "requirement_id": "KERNEL-007",
      "title": "Autonomous priority selection",
      "source": "MUCARO_RELEASE_ENGINEERING_CONTRACT_V1",
      "requirement_class": "PROCESS",
      "scope_state": "IN_SCOPE",
      "verification_method": "PROCESS_AUDIT",
      "crosswalk": []
    },
    {
      "requirement_id": "KERNEL-008",
      "title": "Preferred dependency vector",
      "source": "MUCARO_RELEASE_ENGINEERING_CONTRACT_V1",
      "requirement_class": "PROCESS",
      "scope_state": "IN_SCOPE",
      "verification_method": "PROCESS_AUDIT",
      "crosswalk": []
    },
    {
      "requirement_id": "KERNEL-009",
      "title": "Autonomous execution authority",
      "source": "MUCARO_RELEASE_ENGINEERING_CONTRACT_V1",
      "requirement_class": "PROCESS",
      "scope_state": "IN_SCOPE",
      "verification_method": "PROCESS_AUDIT",
      "crosswalk": []
    },
    {
      "requirement_id": "KERNEL-010",
      "title": "Credentials-last rule",
      "source": "MUCARO_RELEASE_ENGINEERING_CONTRACT_V1",
      "requirement_class": "PROCESS",
      "scope_state": "IN_SCOPE",
      "verification_method": "PROCESS_AUDIT",
      "crosswalk": []
    },
    {
      "requirement_id": "KERNEL-011",
      "title": "Execution cycle",
      "source": "MUCARO_RELEASE_ENGINEERING_CONTRACT_V1",
      "requirement_class": "PROCESS",
      "scope_state": "IN_SCOPE",
      "verification_method": "PROCESS_AUDIT",
      "crosswalk": []
    },
    {
      "requirement_id": "KERNEL-012",
      "title": "Preemptive hardening",
      "source": "MUCARO_RELEASE_ENGINEERING_CONTRACT_V1",
      "requirement_class": "PROCESS",
      "scope_state": "IN_SCOPE",
      "verification_method": "PROCESS_AUDIT",
      "crosswalk": []
    },
    {
      "requirement_id": "KERNEL-013",
      "title": "Anti-loop rule",
      "source": "MUCARO_RELEASE_ENGINEERING_CONTRACT_V1",
      "requirement_class": "PROCESS",
      "scope_state": "IN_SCOPE",
      "verification_method": "PROCESS_AUDIT",
      "crosswalk": []
    },
    {
      "requirement_id": "KERNEL-014",
      "title": "Contradiction handling",
      "source": "MUCARO_RELEASE_ENGINEERING_CONTRACT_V1",
      "requirement_class": "PROCESS",
      "scope_state": "IN_SCOPE",
      "verification_method": "LEDGER_VALIDATOR",
      "crosswalk": []
    },
    {
      "requirement_id": "KERNEL-015",
      "title": "Testing escalation",
      "source": "MUCARO_RELEASE_ENGINEERING_CONTRACT_V1",
      "requirement_class": "PROCESS",
      "scope_state": "IN_SCOPE",
      "verification_method": "PROCESS_AUDIT",
      "crosswalk": []
    },
    {
      "requirement_id": "KERNEL-016",
      "title": "Positive and negative gates",
      "source": "MUCARO_RELEASE_ENGINEERING_CONTRACT_V1",
      "requirement_class": "PROCESS",
      "scope_state": "IN_SCOPE",
      "verification_method": "PROCESS_AUDIT",
      "crosswalk": []
    },
    {
      "requirement_id": "KERNEL-017",
      "title": "Tool-routing preference",
      "source": "MUCARO_RELEASE_ENGINEERING_CONTRACT_V1",
      "requirement_class": "PROCESS",
      "scope_state": "IN_SCOPE",
      "verification_method": "PROCESS_AUDIT",
      "crosswalk": []
    },
    {
      "requirement_id": "KERNEL-018",
      "title": "Source refresh and artifact reuse",
      "source": "MUCARO_RELEASE_ENGINEERING_CONTRACT_V1",
      "requirement_class": "PROCESS",
      "scope_state": "IN_SCOPE",
      "verification_method": "PROCESS_AUDIT",
      "crosswalk": []
    },
    {
      "requirement_id": "KERNEL-019",
      "title": "Scope-delta control",
      "source": "MUCARO_RELEASE_ENGINEERING_CONTRACT_V1",
      "requirement_class": "PROCESS",
      "scope_state": "IN_SCOPE",
      "verification_method": "LEDGER_VALIDATOR",
      "crosswalk": []
    },
    {
      "requirement_id": "KERNEL-020",
      "title": "Blocker behavior",
      "source": "MUCARO_RELEASE_ENGINEERING_CONTRACT_V1",
      "requirement_class": "PROCESS",
      "scope_state": "IN_SCOPE",
      "verification_method": "LEDGER_VALIDATOR",
      "crosswalk": []
    },
    {
      "requirement_id": "KERNEL-021",
      "title": "Progress communication",
      "source": "MUCARO_RELEASE_ENGINEERING_CONTRACT_V1",
      "requirement_class": "PROCESS",
      "scope_state": "IN_SCOPE",
      "verification_method": "PROCESS_AUDIT",
      "crosswalk": []
    },
    {
      "requirement_id": "KERNEL-022",
      "title": "Hard stop conditions",
      "source": "MUCARO_RELEASE_ENGINEERING_CONTRACT_V1",
      "requirement_class": "PROCESS",
      "scope_state": "IN_SCOPE",
      "verification_method": "PROCESS_AUDIT",
      "crosswalk": []
    },
    {
      "requirement_id": "INV-001",